id;name;imageUrl;priceMayorista;priceSugerido;description;variants;category
1;Jabon Facial CeramiLux;https://content.pancake.vn/2-2512/s800x800/2025/12/9/51a9f6f1fdd4ba9cec4cc4a8bee7a04e9b27d497.jpg;21600;36000;Limpia profundamente mientras protege la barrera de la piel.;N/A;CeramiLux
2;Crema Hidratante CeramiLux;https://content.pancake.vn/2-2512/s800x800/2025/12/9/ce75547c9b4bc2d1667011fa10d2492428ee5d33.jpg;22800;38000;Hidratación intensa con ceramidas para restaurar la piel.;N/A;CeramiLux
3;Tónico CeramiLux;https://content.pancake.vn/2-2512/s800x800/2025/12/9/164d395cb3f399c8f628f9f907c22f3dd97dc7f6.jpg;22200;37000;Equilibra el pH y prepara la piel para la hidratación.;N/A;CeramiLux
4;Suero CeramiLux;https://content.pancake.vn/2-2512/s800x800/2025/12/9/a4c4a7b3a391e26ce010bc33ae8d2e5febf61757.jpg;22200;37000;Suero concentrado para una reparación intensiva.;N/A;CeramiLux
5;Protector Solar CeramiLux;https://content.pancake.vn/2-2512/s800x800/2025/12/9/1d3752221738260b8826b39a3b4a565acc43c46c.jpg;30000;50000;Alta protección solar con acabado invisible.;N/A;CeramiLux
6;Kit Viajero CeramiLux;https://content.pancake.vn/2-2512/s800x800/2025/12/9/f732dc40a38dcb6f909cd0d69f4d424050bf7aa4.jpg;48000;80000;Incluye múltiples productos en tamaño de viaje.;N/A;CeramiLux
7;Suero de Ácido Hialurónico;https://content.pancake.vn/2-2512/s800x800/2025/12/9/6f2d951e1a9a0cf3b4dca17b0ea49c24dc1752f6.webp;23750;38000;Ayuda a retener la humedad de la piel. Disminuye líneas de expresión.;N/A;Ácido Hialurónico
8;Crema Hidratante de Ácido Hialurónico;https://content.pancake.vn/2-2512/s800x800/2025/12/9/15e47d4385a15cfc9f24707916ebd33f7c02271d.webp;22200;37000;Proporciona hidratación profunda y duradera.;N/A;Ácido Hialurónico
9;Espuma Limpiadora de Ácido Hialurónico;https://content.pancake.vn/2-2512/s800x800/2025/12/9/9688d241470c91a03522434e00568405ea7c61d4.webp;23400;39000;Hidrata y deja la piel suave y luminosa.;N/A;Ácido Hialurónico
10;Tónico de Ácido Hialurónico;https://content.pancake.vn/2-2512/s800x800/2025/12/9/74d00513d35719dd4675b709d2c42c5558f4796a.webp;23400;39000;Refresca al instante y aporta un glow natural.;N/A;Ácido Hialurónico
11;Mascarilla de Ojos x6;https://content.pancake.vn/2-2512/s800x800/2025/12/9/c9814942586c6f4892a5f9a3a3f2b6a4614d1884.jpg;;;;;
12;Kit x4 Ácido Hialurónico;https://content.pancake.vn/2-2512/s800x800/2025/12/9/d7ac82fb39575f3524bd7b4c45ac7d43f78d365b.jpg;98400;164000;Incluye: Espuma, Sérum, Tónico, Crema;N/A;Ácido Hialurónico
13;Espuma Limpiadora Niamicida;https://content.pancake.vn/2-2512/s800x800/2025/12/9/51032c05a6a651b083eb99f49e1285920e6ed424.webp;3600;6000;Ayuda a retener la humedad de la piel.;N/A;Ácido Hialurónico
14;Crema Facial Niamicida;https://content.pancake.vn/2-2512/s800x800/2025/12/9/b09670a9b72723606f028ceb20971dbf61302654.webp;10800;18000;Hidrata;N/A;Ácido Hialurónico
15;Tónico Hidratante Niacinamida;https://content.pancake.vn/2-2512/s800x800/2025/12/9/f67e2d6ea6766fbc7b120fc264204dbcd6ce0ee4.webp;23400;39000;Limpia y ayuda a reducir la apariencia de poros.;N/A;Niacinamida
16;Contorno de Ojos Niacinamida;https://content.pancake.vn/2-2512/s800x800/2025/12/9/4409fec8723f07b1427c290573b3668635261cc3.webp;23400;39000;Hidrata y unifica el tono de la piel.;N/A;Niacinamida
17;Suero Niacinamida;https://content.pancake.vn/2-2512/s800x800/2025/12/9/72ea473c2891804af4116929392c32d73f6966f3.webp;21600;36000;Refresca y minimiza poros.;N/A;Niacinamida
18;Kit Niacinamida x 3 Productos;https://content.pancake.vn/2-2512/s800x800/2025/12/9/4e719baba01d6b06c55174f3a7ada0bc85f628be.webp;17880;29800;Ayuda a reducir ojeras y líneas finas.;N/A;Niacinamida
19;Tónico Colageno y Vitaminas;https://content.pancake.vn/2-2512/s800x800/2025/12/9/8e5bfada6304660a5f4b4ff27f7b846079c65ade.jpg;22200;37000;Concentrado de niacinamida para control de grasa y manchas.;N/A;Niacinamida
20;Espuma Autobronceadora Aurum;https://content.pancake.vn/2-2512/s800x800/2025/12/9/dc6fb709e297bc158435b71259656ec0d44972fb.jpg;60000;100000;Incluye: Contorno de Ojos, Sérum, Crema Facial;N/A;Niacinamida
21;Crema Rostro Péptidos Aurum;https://content.pancake.vn/2-2512/s800x800/2025/12/9/eabfbf768b00f1d057842cf230ab7914ea884cd4.jpg;26250;42000;Proporciona hidratación profunda y duradera.;N/A;Colágeno y Vitaminas
22;Contorno de Ojos Péptidos Aurum;https://content.pancake.vn/2-2512/s800x800/2025/12/9/c6b80c9712bb257f5be320a7572a3d0b4d9176b8.jpg;30000;50000;Bronceado natural y uniforme sin sol.;Light Medium|Medium Dark;Aurum
23;Suero de Rostro Péptidos Aurum;https://content.pancake.vn/2-2512/s800x800/2025/12/9/69f7b816d4787332383e85b1c129578d1347f504.jpg;25200;42000;Crema facial con péptidos para firmeza.;N/A;Aurum
24;Crema Hidratante Post Bronceado Aurum;https://content.pancake.vn/2-2512/s800x800/2025/12/9/f033637e252f59e371dcf7b3e24382e898601492.jpg;25200;42000;Reduce arrugas y reafirma el contorno de ojos.;N/A;Aurum
25;Kit Péptidos Aurum con Cosmetiquera;https://content.pancake.vn/2-2512/s800x800/2025/12/9/4931c4574b6904930e685d9ccc105808ede106eb.jpg;16800;28000;Suero concentrado de péptidos antiedad.;N/A;Aurum
26;Shimmer Corporal Aurum;https://content.pancake.vn/2-2512/s800x800/2025/12/9/7ce30df8ebd436fb8c12978071649da462e24f8e.jpg;24000;40000;Calma e hidrata la piel después del bronceado.;N/A;Aurum
27;Base Aqua;https://content.pancake.vn/2-2512/s800x800/2025/12/9/e89531dbf0250ed6c428707443a776eb8a6e8234.jpg;70800;118000;Incluye: Crema Rostro, Contorno de Ojos, Suero;N/A;Aurum
28;Base Stay Matte;https://content.pancake.vn/2-2512/s800x800/2025/12/9/e9a22001d393a7d1abd065d0e1f3e93e3356df6d.jpg;14280;23800;Refresca;N/A;Finalizadores
29;Base Nude Illusion;https://content.pancake.vn/2-2512/s800x800/2025/12/9/093ffd80e39e5756a26791abb2de9e51bf7333b3.jpg;15674;25957;Unifica el tono y aporta luminosidad.;N/A;Finalizadores
30;Corrector Máximo Cubrimiento;https://content.pancake.vn/2-2512/s800x800/2025/12/9/c074cd69bc9e9abe5ccac7ba99240c2c36225e43.jpg;24375;39000;Acabado natural dewy (hidratado);02|03|04|05|06|07|4.5;Bases
31;;;28125;45000;Acabado mate, libre de aceite, textura ligera;420|425|525|535|620|625|630|635;Bases
32;;;32375;50000;Alta cobertura para imperfecciones;802|804|808|812;Bases
33;;;18750;30000;Alta cobertura para imperfecciones;01|02|04|05|06|07|09|11;Correctores
34;Corrector Hidratante con Ácido Hialurónico;;17400;29000;Cobertura media, acabado natural;2 tonos;Correctores
35;Contorno Cremoso con Ácido Hialurónico;;11250;18000;Textura cremosa para corregir e iluminar;N/A;Correctores
36;Polvo Finalizador HD;;19800;33000;Fija el maquillaje, acabado mate;N/A;Polvos
37;Polvo Compacto Rice Silk;;22375;35800;Prolonga duración, difumina poros, controla brillo;03|04|06;Polvos
38;Polvo Mineralizado Cobertura Total;;15000;25000;Polvo mineralizado de alta cobertura.;03|06|08;Polvos
39;Polvo Suelto Rice Silk;;19801;33801;Controla brillo, acabado mate;N/A;Polvos
40;Rubor Color Bost;;15600;26000;Rubor compacto de alta pigmentación.;N/A;Rubores
41;Rubor Líquido Daily Essentials Display x36;https://content.pancake.vn/2-2510/s800x800/2025/10/29/84219553a0f7f8ce96d3415a0687cff6835dcda1.jpg;13200;22000;Acabado natural y jugoso, fácil de difuminar.;N/A;Rubores
42;Iluminador Compacto Get Picture;https://content.pancake.vn/2-2510/s800x800/2025/10/29/30140eeba7bba53f0a34387191756eb24d4425e4.jpg;19375;31000;Textura sedosa con micro perlas reflectantes;N/A;Iluminadores
43;Iluminador Gel Display x36;https://content.pancake.vn/2-2510/s800x800/2025/10/29/30140eeba7bba53f0a34387191756eb24d4425e4.jpg;19080;31800;Acabado luminoso, textura suave;N/A;Iluminadores
44;Iluminador Líquido Daily Essentials;https://content.pancake.vn/2-2510/s800x800/2025/10/29/30140eeba7bba53f0a34387191756eb24d4425e4.jpg;20280;33800;Iluminador líquido para un glow intenso.;AH01|AH02|AH03|AH04|AH05|AH06;Iluminadores
45;Paleta Iluminadores Daily Essentials Display x24;https://content.pancake.vn/2-2510/s800x800/2025/10/29/30140eeba7bba53f0a34387191756eb24d4425e4.jpg;15600;26000;Paleta con múltiples tonos de iluminador.;N/A;Iluminadores
46;Paleta de Sombras Pink Cloud;https://content.pancake.vn/2-2510/s800x800/2025/10/29/cd313b2a81626a4a7ab155a0ca8e161c9817017a.jpg;20280;38800;Tonos rosados y nudes para looks románticos.;N/A;Paletas
47;Paleta de Sombras Red Clay;https://content.pancake.vn/2-2510/s800x800/2025/10/29/cd313b2a81626a4a7ab155a0ca8e161c9817017a.jpg;20280;38800;Tonos cálidos y terracota.;N/A;Paletas
48;Paleta Contornos Daily Essentials OG Display x24;https://content.pancake.vn/2-2510/s800x800/2025/10/29/cd313b2a81626a4a7ab155a0ca8e161c9817017a.jpg;15600;26000;Paleta para contorno e iluminación.;N/A;Paletas
49;Delineador Líquido en Plumón Negro;https://content.pancake.vn/2-2510/s800x800/2025/10/29/633eeea81982dcd8d62ef1819994b134e7aee6a6.jpg;10625;17000;Acabado mate, punta súper fina;N/A;Ojos
50;Lápiz en Gel a Prueba de Agua;https://content.pancake.vn/2-2510/s800x800/2025/10/29/633eeea81982dcd8d62ef1819994b134e7aee6a6.jpg;10200;17000;Lápiz de ojos en gel de larga duración.;N/A;Ojos
51;Lápiz Ojos Gel Keep Your Balance;https://content.pancake.vn/2-2510/s800x800/2025/10/29/633eeea81982dcd8d62ef1819994b134e7aee6a6.jpg;7800;13000;Lápiz cremoso y de alta pigmentación.;N/A;Ojos
52;Lápiz Ojos Gel Keep Your Balance;https://content.pancake.vn/2-2510/s800x800/2025/10/29/633eeea81982dcd8d62ef1819994b134e7aee6a6.jpg;7800;13000;Lápiz cremoso y de alta pigmentación.;N/A;Ojos
53;Lápiz con Cepillo para Cejas;https://content.pancake.vn/2-2510/s800x800/2025/10/29/633eeea81982dcd8d62ef1819994b134e7aee6a6.jpg;5375;8600;Acabado mate, incluye cepillo difuminador;N/A;Ojos
54;Pestañina Voluminizadora a Prueba de Agua;https://content.pancake.vn/2-2510/s800x800/2025/10/29/633eeea81982dcd8d62ef1819994b134e7aee6a6.jpg;13080;21800;Volumen extremo y resistente al agua.;N/A;Ojos
55;Pestañina Volumen;https://content.pancake.vn/2-2510/s800x800/2025/10/29/633eeea81982dcd8d62ef1819994b134e7aee6a6.jpg;18750;30000;Engrosa y da volumen a las pestañas;N/A;Ojos
56;Brillo Labial Nude Pure Glow Display x36;https://content.pancake.vn/2-2510/s800x800/2025/10/29/47aceecdd2a4811c65b7286b1d8e1d4ea9844a6e.jpg;18000;30000;Hidratación y volumen con aceites naturales;N/A;Labios
57;Brillo Labial Metalizado Pure Glow Display x36;https://content.pancake.vn/2-2510/s800x800/2025/10/29/47aceecdd2a4811c65b7286b1d8e1d4ea9844a6e.jpg;18000;30000;Hidratación de larga duración hasta 8 horas;N/A;Labios
58;Bálsamo Labial Pure Glow x36;https://content.pancake.vn/2-2510/s800x800/2025/10/29/47aceecdd2a4811c65b7286b1d8e1d4ea9844a6e.jpg;18000;30000;Hidrata;Q4 Strawberry|Q5 Raspberry;Labios
59;Lápiz Labial True Nude;https://content.pancake.vn/2-2510/s800x800/2025/10/29/47aceecdd2a4811c65b7286b1d8e1d4ea9844a6e.jpg;7080;11000;Labial mate en tonos nude.;T06|T07|T08|T09|T10|T11;Labios
60;Kit True Nude;https://content.pancake.vn/2-2510/s800x800/2025/10/29/47aceecdd2a4811c65b7286b1d8e1d4ea9844a6e.jpg;22600;37800;Kit de labiales en tonos nude.;06|09|10;Labios
61;Labial True Nude;https://content.pancake.vn/2-2510/s800x800/2025/10/29/47aceecdd2a4811c65b7286b1d8e1d4ea9844a6e.jpg;22600;37800;Labial mate confortable.;6.09;Labios
62;Mascarilla Labios Display x24;https://content.pancake.vn/2-2510/s800x800/2025/10/29/47aceecdd2a4811c65b7286b1d8e1d4ea9844a6e.jpg;17880;29800;Exfolia e hidrata labios;N/A;Labios
63;Limpia Brochas;https://content.pancake.vn/2-2510/s800x800/2025/10/29/de4e67f778bbea7be40c8af51b49d93e879a8c17.jpg;17106;28511;Limpia y desinfecta brochas;N/A;Brochas
64;Brocha para Polvos Mediana;https://content.pancake.vn/2-2510/s800x800/2025/10/29/de4e67f778bbea7be40c8af51b49d93e879a8c17.jpg;13773;22955;Brocha suave para aplicar polvos.;N/A;Brochas
65;Brocha Gota Iluminador;https://content.pancake.vn/2-2510/s800x800/2025/10/29/de4e67f778bbea7be40c8af51b49d93e879a8c17.jpg;7393;12321;Brocha en forma de gota para iluminador.;N/A;Brochas
66;Brocha para Polvos Grande;https://content.pancake.vn/2-2510/s800x800/2025/10/29/de4e67f778bbea7be40c8af51b49d93e879a8c17.jpg;16046;26743;Brocha grande para polvos sueltos o compactos.;N/A;Brochas
67;Pincel Difuminador Plano;https://content.pancake.vn/2-2510/s800x800/2025/10/29/de4e67f778bbea7be40c8af51b49d93e879a8c17.jpg;5175;8626;Pincel plano para difuminar sombras.;N/A;Brochas
68;Pincel Difuminador Redondo;https://content.pancake.vn/2-2510/s800x800/2025/10/29/de4e67f778bbea7be40c8af51b49d93e879a8c17.jpg;6106;10177;Pincel redondo para difuminar en la cuenca.;N/A;Brochas
69;Pincel Difuminador Gota;https://content.pancake.vn/2-2510/s800x800/2025/10/29/de4e67f778bbea7be40c8af51b49d93e879a8c17.jpg;5175;8626;Pincel de precisión para difuminar.;N/A;Brochas
70;Pincel Doble de Cejas;https://content.pancake.vn/2-2510/s800x800/2025/10/29/de4e67f778bbea7be40c8af51b49d93e879a8c17.jpg;5175;8626;Pincel angular y cepillo para cejas.;N/A;Brochas
71;Pincel Corto Lengua de Gato;https://content.pancake.vn/2-2510/s800x800/2025/10/29/de4e67f778bbea7be40c8af51b49d93e879a8c17.jpg;4680;7800;Pincel para aplicar corrector o sombra.;N/A;Brochas
72;Brocha Deluxe Gota Iluminador;https://content.pancake.vn/2-2510/s800x800/2025/10/29/de4e67f778bbea7be40c8af51b49d93e879a8c17.jpg;16046;26743;Brocha deluxe para iluminador.;N/A;Brochas
73;Brocha Deluxe para Polvos Grande;https://content.pancake.vn/2-2510/s800x800/2025/10/29/de4e67f778bbea7be40c8af51b49d93e879a8c17.jpg;13773;22955;Brocha deluxe para polvos.;N/A;Brochas
74;Brocha Deluxe para Polvos Mediana;https://content.pancake.vn/2-2510/s800x800/2025/10/29/de4e67f778bbea7be40c8af51b49d93e879a8c17.jpg;7393;12321;Brocha deluxe mediana para polvos.;N/A;Brochas
75;Pincel Deluxe para Corrector;https://content.pancake.vn/2-2510/s800x800/2025/10/29/de4e67f778bbea7be40c8af51b49d93e879a8c17.jpg;7054;13090;Pincel deluxe para aplicar corrector.;N/A;Brochas
76;Pincel Deluxe Difuminador Gota;https://content.pancake.vn/2-2510/s800x800/2025/10/29/de4e67f778bbea7be40c8af51b49d93e879a8c17.jpg;5175;8626;Pincel deluxe de precisión.;N/A;Brochas
77;Pincel Deluxe Difuminador Redondo;https://content.pancake.vn/2-2510/s800x800/2025/10/29/de4e67f778bbea7be40c8af51b49d93e879a8c17.jpg;6106;10177;Pincel deluxe para difuminar.;N/A;Brochas
78;Pincel Deluxe Difuminador Plano;https://content.pancake.vn/2-2510/s800x800/2025/10/29/de4e67f778bbea7be40c8af51b49d93e879a8c17.jpg;5175;8626;Pincel deluxe plano.;N/A;Brochas
79;Pincel Deluxe Doble de Cejas;https://content.pancake.vn/2-2510/s800x800/2025/10/29/de4e67f778bbea7be40c8af51b49d93e879a8c17.jpg;5175;8626;Pincel deluxe para cejas.;N/A;Brochas
80;Espejo iPad Pequeños Colores Surtidos;https://content.pancake.vn/2-2510/s800x800/2025/10/29/8080dc3ed4a4a82e79c357edc5f67100620130a5.jpg;8400;14000;Espejo de mano en colores surtidos.;Amarillo| gris| rosado | azul;Espejos
81;Espejo iPad Rosa Grande;https://content.pancake.vn/2-2510/s800x800/2025/10/29/8080dc3ed4a4a82e79c357edc5f67100620130a5.jpg;14000;24000;Espejo grande con diseño iPad.;N/A;Espejos
82;Espejo iPad Negro Grande;https://content.pancake.vn/2-2510/s800x800/2025/10/29/8080dc3ed4a4a82e79c357edc5f67100620130a5.jpg;14000;24000;Espejo grande con diseño iPad.;N/A;Espejos
83;Cosmetiquera OG;https://content.pancake.vn/2-2510/s800x800/2025/10/29/0e21c814a62d8e17b9082fcb45368b79ba80564e.jpg;12000;20000;Colores surtidos;Negro| gris| rosado | azul;Cosmetiqueras
84;Cosmetiquera OG;https://content.pancake.vn/2-2510/s800x800/2025/10/29/0e21c814a62d8e17b9082fcb45368b79ba80564e.jpg;12000;20000;Colores surtidos;N/A;Cosmetiqueras
85;Cosmetiquera OG;https://content.pancake.vn/2-2510/s800x800/2025/10/29/0e21c814a62d8e17b9082fcb45368b79ba80564e.jpg;12000;20000;Colores surtidos;N/A;Cosmetiqueras
86;Cosmetiquera OG;https://content.pancake.vn/2-2510/s800x800/2025/10/29/0e21c814a62d8e17b9082fcb45368b79ba80564e.jpg;12000;20000;Colores surtidos;N/A;Cosmetiqueras
87;Cosmetiquera OG;https://content.pancake.vn/2-2510/s800x800/2025/10/29/0e21c814a62d8e17b9082fcb45368b79ba80564e.jpg;12000;20000;Colores surtidos;N/A;Cosmetiqueras
88;Cosmetiquera OG;https://content.pancake.vn/2-2510/s800x800/2025/10/29/0e21c814a62d8e17b9082fcb45368b79ba80564e.jpg;12000;20000;Colores surtidos;N/A;Cosmetiqueras
89;Cosmetiquera Tejida OG Grande Crema;https://content.pancake.vn/2-2510/s800x800/2025/10/29/0e21c814a62d8e17b9082fcb45368b79ba80564e.jpg;26400;44000;Cosmetiquera tejida de gran capacidad.;N/A;Cosmetiqueras
90;Maleta Mediana Negra con Luz LED;https://content.pancake.vn/2-2510/s800x800/2025/10/29/0e21c814a62d8e17b9082fcb45368b79ba80564e.jpg;90000;150000;Incluye cargador y separador;N/A;Maletas
91;Maleta Mediana Palo de Rosa con Luz LED;https://content.pancake.vn/2-2510/s800x800/2025/10/29/0e21c814a62d8e17b9082fcb45368b79ba80564e.jpg;90000;150000;Incluye cargador y separador;N/A;Maletas
92;Bolso Maquillaje Premium Transparente;https://placehold.co/400x400/FFF/333?text=Maleta;0;0;Bolso transparente para maquillaje.;N/A;Maletas
93;Maleta Maquillaje + Cosmetiqueras Auxiliares;https://placehold.co/400x400/FFF/333?text=Maleta;0;0;Medidas: 28x28x11 cm;N/A;Maletas
94;Maleta Maquillaje + Cosmetiqueras Auxiliares;https://placehold.co/400x400/FFF/333?text=Maleta;0;0;Medidas: 28x28x11 cm;N/A;Maletas
95;Maleta + Bolso Maquillador Profesional Premium;https://placehold.co/400x400/FFF/333?text=Maleta;0;0;Medidas: 28x40x70 cm;N/A;Maletas
96;Maleta Dura Maquillador con Compartimientos;https://placehold.co/400x400/FFF/333?text=Maleta;0;0;Maleta rígida profesional.;N/A;Maletas
97;Maleta Negra Lisa Mediana;https://placehold.co/400x400/FFF/333?text=Maleta;0;0;Maleta mediana lisa de color negro.;N/A;Maletas
98;Maleta Rosada Lisa Mediana;https://placehold.co/400x400/FFF/333?text=Maleta;0;0;Maleta mediana lisa de color rosado.;N/A;Maletas
99;Maleta Blanca Lisa Mediana;https://placehold.co/400x400/FFF/333?text=Maleta;0;0;Maleta mediana lisa de color blanco.;N/A;Maletas
100;Maleta Tornasol Mediana;https://placehold.co/400x400/FFF/333?text=Maleta;0;0;Maleta mediana con acabado tornasol.;N/A;Maletas
101;Maleta Leopardo Mediana;https://placehold.co/400x400/FFF/333?text=Maleta;0;0;Maleta mediana con estampado de leopardo.;N/A;Maletas
102;Maleta Boreal Mediana;https://placehold.co/400x400/FFF/333?text=Maleta;0;0;Maleta mediana con acabado boreal.;N/A;Maletas
103;Maleta Gris F. Geométricas Mediana;https://placehold.co/400x400/FFF/333?text=Maleta;0;0;Maleta mediana gris con figuras geométricas.;N/A;Maletas
104;Maleta Dorada Mediana;https://placehold.co/400x400/FFF/333?text=Maleta;0;0;Maleta mediana de color dorado.;N/A;Maletas
105;Maleta Verde Esmeralda F. Geométricas Mediana;https://placehold.co/400x400/FFF/333?text=Maleta;0;0;Maleta mediana verde con figuras geométricas.;N/A;Maletas
106;Maleta Dorada Grande;https://placehold.co/400x400/FFF/333?text=Maleta;0;0;Medidas: 28x10.5x40.5 cm;N/A;Maletas
107;Maleta Blanca Lisa Grande;https://placehold.co/400x400/FFF/333?text=Maleta;0;0;Medidas: 28x10.5x40.5 cm;N/A;Maletas
108;Maleta Verde Esmeralda F. Geométricas Grande;https://placehold.co/400x400/FFF/333?text=Maleta;0;0;Medidas: 28x10.5x40.5 cm;N/A;Maletas
109;Maleta Boreal Grande;https://placehold.co/400x400/FFF/333?text=Maleta;0;0;Medidas: 28x10.5x40.5 cm;N/A;Maletas
110;Maleta Leopardo Grande;https://placehold.co/400x400/FFF/333?text=Maleta;0;0;Medidas: 28x10.5x40.5 cm;N/A;Maletas
111;Maleta Doble Cierre Marmol Blanca;https://placehold.co/400x400/FFF/333?text=Maleta;0;0;Maleta doble cierre con diseño de mármol.;N/A;Maletas
112;Maleta Doble Cierre Marmol Negra;https://placehold.co/400x400/FFF/333?text=Maleta;0;0;Maleta doble cierre con diseño de mármol.;N/A;Maletas
113;Maleta Doble Cierre Palo de Rosa;https://placehold.co/400x400/FFF/333?text=Maleta;0;0;Maleta doble cierre color palo de rosa.;N/A;Maletas
114;Depilador;https://content.pancake.vn/2-2510/s800x800/2025/10/29/0e21c814a62d8e17b9082fcb45368b79ba80564e.jpg;3000;5000;Perfilador/Depilador facial.;N/A;Herramientas
115;Papeles Quita Grasa;https://content.pancake.vn/2-2510/s800x800/2025/10/29/0e21c814a62d8e17b9082fcb45368b79ba80564e.jpg;5400;9000;Papeles de arroz para absorber grasa facial.;N/A;Herramientas
116;Beauty Sponge OG;https://content.pancake.vn/2-2510/s800x800/2025/10/29/0e21c814a62d8e17b9082fcb45368b79ba80564e.jpg;4200;7000;Colores surtidos;N/A;Herramientas
117;Luz LED Inalámbrica;https://content.pancake.vn/2-2510/s800x800/2025/10/29/0e21c814a62d8e17b9082fcb45368b79ba80564e.jpg;24900;0;Tres modos de color;N/A;Herramientas
118;Spray Hidratante de Vitamina C;https://placehold.co/400x400/FFF/333?text=Cuidado;0;0;Spray facial hidratante con Vitamina C.;N/A;Cuidado Personal
119;Contorno de Ojos Crisantemo Negro;https://placehold.co/400x400/FFF/333?text=Cuidado;0;0;Contorno de ojos para hidratación.;N/A;Cuidado Personal
120;Spray Bucal Arándanos;https://placehold.co/400x400/FFF/333?text=Cuidado;0;0;Spray bucal refrescante sabor arándanos.;N/A;Cuidado Personal
121;Spray Bucal Durazno;https://placehold.co/400x400/FFF/333?text=Cuidado;0;0;Spray bucal refrescante sabor durazno.;N/A;Cuidado Personal
